{
	"definitions": {},
	"$schema": "http://json-schema.org/draft-06/schema#",
	"$id": "https://github.com/ShinyId3Tagger/Shiny-ID3-Tagger/accounts.default.json",
	"type": "object",
	"properties": {
		"GitHub": {
			"type": "object",
			"properties": {
				"AccessToken": {
					"type": "string"
				}
			},
			"required": [
				"AccessToken"
			]
		},
		"7digital": {
			"type": "object",
			"properties": {
				"key": {
					"type": "string"
				}
			},
			"required": [
				"key"
			]
		},
		"Amazon": {
			"type": "object",
			"properties": {
				"AssociateTag": {
					"type": "string"
				},
				"AccessKey": {
					"type": "string"
				},
				"SecretKey": {
					"type": "string"
				}
			},
			"required": [
				"AssociateTag",
				"AccessKey",
				"SecretKey"
			]
		},
		"Apiseeds": {
			"type": "object",
			"properties": {
				"ApiKey": {
					"type": "string"
				}
			},
			"required": [
				"ApiKey"
			]
		},
		"Decibel": {
			"type": "array",
			"uniqueItems": true,
			"items": {
				"type": "object",
				"properties": {
					"AppId": {
						"type": "string"
					},
					"AppKey": {
						"type": "string"
					}
				},
				"required": [
					"AppId",
					"AppKey"
				]
			}
		},
		"Discogs": {
			"type": "object",
			"properties": {
				"Key": {
					"type": "string"
				},
				"Secret": {
					"type": "string"
				}
			},
			"required": [
				"Key",
				"Secret"
			]
		},
		"Genius": {
			"type": "object",
			"properties": {
				"AccessToken": {
					"type": "string"
				}
			},
			"required": [
				"AccessToken"
			]
		},
		"Gracenote": {
			"type": "object",
			"properties": {
				"ClientId": {
					"type": "string"
				},
				"UserId": {
					"type": "string"
				}
			},
			"required": [
				"ClientId",
				"UserId"
			]
		},
		"Lastfm": {
			"type": "object",
			"properties": {
				"ApiKey": {
					"type": "string"
				}
			},
			"required": [
				"ApiKey"
			]
		},
		"MusicGraph": {
			"type": "array",
			"uniqueItems": true,
			"items": {
				"type": "object",
				"properties": {
					"AppKey": {
						"type": "string"
					}
				},
				"required": [
					"AppKey"
				]
			}
		},
		"Musixmatch": {
			"type": "array",
			"uniqueItems": true,
			"items": {
				"type": "object",
				"properties": {
					"ApiKey": {
						"type": "string"
					}
				},
				"required": [
					"ApiKey"
				]
			}
		},
		"MsGroove": {
			"type": "object",
			"properties": {
				"ClientId": {
					"type": "string"
				},
				"ClientSecret": {
					"type": "string"
				}
			},
			"required": [
				"ClientId",
				"ClientSecret"
			]
		},
		"Napster": {
			"type": "object",
			"properties": {
				"ApiKey": {
					"type": "string"
				}
			},
			"required": [
				"ApiKey"
			]
		},
		"Qobuz": {
			"type": "object",
			"properties": {
				"AppId": {
					"type": "string"
				}
			},
			"required": [
				"AppId"
			]
		},
		"Spotify": {
			"type": "object",
			"properties": {
				"ClientId": {
					"type": "string"
				},
				"ClientSecret": {
					"type": "string"
				}
			},
			"required": [
				"ClientId",
				"ClientSecret"
			]
		},
		"Tidal": {
			"type": "object",
			"properties": {
				"Username": {
					"type": "string"
				},
				"Password": {
					"type": "string"
				},
				"Token": {
					"type": "string"
				}
			},
			"required": [
				"Username",
				"Password",
				"Token"
			]
		}
	},
	"additionalProperties": false,
	"required": [
		"GitHub",
		"7digital",
		"Amazon",
		"Apiseeds",
		"Decibel",
		"Discogs",
		"Genius",
		"Gracenote",
		"Lastfm",
		"Musixmatch",
		"Napster",
		"Qobuz",
		"Spotify",
		"Tidal"
	]
}
