{
	"GitHub": {
		"AccessToken": ""
	},
	"7digital": {
		"key": ""
	},
	"Amazon": {
		"AssociateTag": "",
		"AccessKey": "",
		"SecretKey": ""
	},
	"Apiseeds": {
		"ApiKey": ""
	},
	"Decibel": [
		{
			"AppId": "",
			"AppKey": ""
		}
	],
	"Discogs": {
		"Key": "",
		"Secret": ""
	},
	"Genius": {
		"AccessToken": ""
	},
	"Gracenote": {
		"ClientId": "",
		"UserId": ""
	},
	"Lastfm": {
		"ApiKey": ""
	},
	"Musixmatch": [
		{
			"ApiKey": ""
		}
	],
	"Napster": {
		"ApiKey": ""
	},
	"Qobuz": {
		"AppId": ""
	},
	"Spotify": {
		"ClientId": "",
		"ClientSecret": ""
	},
	"Tidal": {
		"Username": "",
		"Password": "",
		"Token": ""
	}
}
