{
	"GitHub": {
		"AccessToken": "xxxxxxxxxxxxxxxxxxxxxxxxxxxxxxxxxxxxxxxx"
	},
	"7digital": {
		"key": "xxxxxxxxxxxx"
	},
	"Amazon": {
		"AssociateTag": "example-tag",
		"AccessKey": "xxxxxxxxxxxxxxxxxxxx",
		"SecretKey": "xxxxxxxxxxxxxxxxxxxxxxxxxxxxxxxxxxxxxxxx"
	},
	"Apiseeds": {
		"ApiKey": "xxxxxxxxxxxxxxxxxxxxxxxxxxxxxxxxxxxxxxxxxxxxxxxxxxxxxxxxxxxxxxxx"
	},
	"Decibel": [
		{
			"AppId": "xxxxxxxx",
			"AppKey": "xxxxxxxxxxxxxxxxxxxxxxxxxxxxxxxx"
		}
	],
	"Discogs": {
		"Key": "xxxxxxxxxxxxxxxxxxxx",
		"Secret": "xxxxxxxxxxxxxxxxxxxxxxxxxxxxxxxx"
	},
	"Genius": {
		"AccessToken": "xxxxxxxxxxxxxxxxxxxxxxxxxxxxxxxxxxxxxxxxxxxxxxxxxxxxxxxxxxxxxxxx"
	},
	"Gracenote": {
		"ClientId": "xxxxxxxxxxxxxxxxxxxxxxxxxxxxxxxxxxxxxxxxxx",
		"UserId": "xxxxxxxxxxxxxxxxxxxxxxxxxxxxxxxxxxxxxxxxxxxxxxxxxx"
	},
	"Lastfm": {
		"ApiKey": "xxxxxxxxxxxxxxxxxxxxxxxxxxxxxxxx"
	},
	"Musixmatch": [
		{
			"ApiKey": "xxxxxxxxxxxxxxxxxxxxxxxxxxxxxxxx"
		}
	],
	"Napster": {
		"ApiKey": "xxxxxxxxxxxxxxxxxxxxxxxxxxxxxxxxxxxxxxxxxxxxxxxx"
	},
	"Qobuz": {
		"AppId": "xxxxxxxxx"
	},
	"Spotify": {
		"ClientId": "xxxxxxxxxxxxxxxxxxxxxxxxxxxxxxxx",
		"ClientSecret": "xxxxxxxxxxxxxxxxxxxxxxxxxxxxxxxx"
	},
	"Tidal": {
		"Username": "mail@example.com",
		"Password": "xxxxxxxxxxxxxxxxxxxx",
		"Token": "xxxxxxxxxxxxxxxx"
	}
}
